{
  "quest_types": [
    "Choose the better question",
    "Find missing parts in a question",
    "Rewrite a vague question",
    "Create a question for a specific learning situation"
  ],
  "quest_flow": [
    "Present a weak or incomplete question.",
    "Ask the learner to identify what is missing.",
    "Guide the learner to revise the question.",
    "Explain why the revised question is stronger."
  ],
  "sample_quests": [
    {
      "title": "Make the science question more specific",
      "objective": "Help the learner add a clear topic and difficulty point.",
      "learner_prompt": "Rewrite this question so a teacher knows exactly what you need: 'I do not get science.'",
      "expected_output": "A revised question that names the topic and the part that is confusing."
    },
    {
      "title": "Add context to a homework help question",
      "objective": "Help the learner explain the current study situation.",
      "learner_prompt": "Improve this question: 'Can someone help me with my assignment?'",
      "expected_output": "A revised question that includes the subject, task type, and current obstacle."
    }
  ],
  "interaction_patterns": [
    "Multiple-choice comparison",
    "Checklist-based diagnosis",
    "Short rewrite task",
    "Scenario-based question building"
  ]
}
